cnpj,nome_cia,ativ_princ,receita_2019,res_antes_tl_2019,ir_corr_2019,ativo_total_2019,pl_2019,receita_2018,res_antes_tl_2018,ir_corr_2018,ativo_total_2018,pl_2018,receita_2017,res_antes_tl_2017,ir_corr_2017,ativo_total_2017,pl_2017,receita_2016,res_antes_tl_2016,ir_corr_2016,ativo_total_2016,pl_2016,receita_2015,res_antes_tl_2015,ir_corr_2015,ativo_total_2015,pl_2015,receita_2014,res_antes_tl_2014,ir_corr_2014,ativo_total_2014,pl_2014,receita_2013,res_antes_tl_2013,ir_corr_2013,ativo_total_2013,pl_2013,receita_2012,res_antes_tl_2012,ir_corr_2012,ativo_total_2012,pl_2012,receita_2011,res_antes_tl_2011,ir_corr_2011,ativo_total_2011,pl_2011
00.622.416/0001-41,STATKRAFT ENERGIAS RENOVAVEIS S.A.,A Companhia Atua No Ramo de Geração de Energia Elétrica Por Meio de Fontes Renováveis.,438070,73119,34739,2203515,1277856,314546,96563,17123,2244231,1225812,310808,2139,11718,1470224,779397,275164,18479,37836,1517504,772004,242513,-32087,9404,1517309,771680,214257,-6190,0,1732263,682012,211340,-41490,10276,1749172,643506,187022,-26795,9949,1895956,687465,143403,6019,3571,1731017,598136
02.062.747/0001-08,SUDESTE S.A.,Participação em Outras Sociedades.,0,-140105,0,203346,203308,0,-127716,0,13612,13413,0,-108980,0,21139,21129,0,-98925,0,20271,20109,0,-88746,0,16206,16034,0,-91905,0,19817,19780,0,-82452,0,13427,11685,0,-82435,0,95729,94137,0,-82993,0,21599,21571
01.957.772/0001-89,SUL 116 PARTICIPACOES S.A.,Participação em Outras Sociedades. Comerciais Ou Civis. Nacionais Ou Estrangeiras. Como Sócia. Acionista Ou Quotista; E A Participação. Como Quotista. em Fundos de Investimento Constuidos Regularmente,0,-3548,0,13269,11464,0,-899,0,11002,10955,0,45,29,11886,11854,0,363,59,11844,11838,0,-682,51,11541,11534,0,-10133,36,12293,12267,0,-60,20,13038,13036,0,152,19,13118,13116,0,461,42,12986,12983
29.978.814/0001-87,SUL AMERICA S.A.,A Sul América S.A. É Uma Sociedade de Participação E Suas Controladas Atuam Nos Setores de Seguros. Previdência Complementar. Administração de Recursos E Assistência à Saúde.,21725615,1556023,572732,28412451,7147705,19831212,1379605,569362,25703769,6287513,17762196,1255962,494886,23449518,5640391,16274044,1139589,463666,21808563,5040908,15064382,1121129,466276,20042735,4430871,13500128,870646,322557,18510274,3965574,11769873,747285,273322,16961967,3618298,10440295,714595,283200,14321812,3345361,8944547,703915,264343,13418826,3076514
60.651.809/0001-05,SUZANO HOLDING S.A.,Sociedade Holding - Participação Como Acionista Ou Quotista No Capital Social de Outras Sociedades,26013344,-4100796,246214,98030669,18164024,13437657,152689,586666,54005818,12056391,0,0,0,0,0,9882629,2411438,189863,29502617,10190949,10224728,-1358637,19781,28621930,9400403,0,0,0,0,0,5689559,-278765,10558,27498554,10876553,5194591,-302030,4814,25694618,10217997,4851760,-97776,8312,22048580,9501855
16.404.287/0001-55,SUZANO S.A.,Indústria E Comércio de Papel E Celulose,26012950,-4097203,246110,97908225,18087969,13437329,163246,586568,53932644,12025935,0,0,0,0,0,9882313,2418193,188817,29399313,10143494,10224361,-1358521,19052,28259985,9192081,0,0,0,0,0,5688625,-279974,9924,27149343,10687239,5192292,-310984,2280,25353437,11002078,4847988,-98305,7893,21715433,9673549
